{
  "schema": "athyper.compiled-entity-artifact/2.0-draft",
  "schemaVersion": 2,
  "contractStatus": "draft_for_review",
  "artifactType": "core",
  "artifactKey": "industry_code/core",
  "entityCode": "industry_code",
  "plane": "neon",
  "storage": {
    "kind": "table",
    "primaryObject": "shared.industry_code",
    "sourceObjects": [
      "shared.industry_code"
    ],
    "idField": "id",
    "tenantField": null,
    "genericWriteEnabled": false
  },
  "fields": [
    {
      "key": "id",
      "binding": {
        "sourceObject": "shared.industry_code",
        "column": "id"
      },
      "dataType": "uuid",
      "storageType": "uuid",
      "nullable": false,
      "label": {
        "labelKey": "entity.industryCode.core.fields.id.label",
        "defaultText": "Id"
      },
      "valueOrigin": "stored",
      "readPolicy": "authorized_projection"
    },
    {
      "key": "domainCode",
      "binding": {
        "sourceObject": "shared.industry_code",
        "column": "domain_code"
      },
      "dataType": "string",
      "storageType": "text",
      "nullable": false,
      "label": {
        "labelKey": "entity.industryCode.core.fields.domainCode.label",
        "defaultText": "Classification scheme"
      },
      "valueOrigin": "stored",
      "readPolicy": "authorized_projection"
    },
    {
      "key": "code",
      "binding": {
        "sourceObject": "shared.industry_code",
        "column": "code"
      },
      "dataType": "string",
      "storageType": "text",
      "nullable": false,
      "label": {
        "labelKey": "entity.industryCode.core.fields.code.label",
        "defaultText": "Code"
      },
      "valueOrigin": "stored",
      "readPolicy": "authorized_projection"
    },
    {
      "key": "name",
      "binding": {
        "sourceObject": "shared.industry_code",
        "column": "name"
      },
      "dataType": "string",
      "storageType": "text",
      "nullable": false,
      "label": {
        "labelKey": "entity.industryCode.core.fields.name.label",
        "defaultText": "Name"
      },
      "valueOrigin": "stored",
      "readPolicy": "authorized_projection"
    }
  ],
  "businessContext": {
    "scopeKind": "shared_reference"
  },
  "referencePicker": {
    "valueField": "id",
    "labelField": "name",
    "displayFormat": "{name} ({code})",
    "allowedTokens": [
      "name",
      "code"
    ],
    "load": "bounded_lookup"
  },
  "dependencies": [
    "platform/core-field-defaults.v1"
  ],
  "validationAuthority": {
    "fieldRules": "compiled_and_server_enforced",
    "domainRules": "registered_handler_and_database_constraints",
    "missingEvaluator": "block_write",
    "uiVisibilityGrantsAccess": false
  },
  "projectionPolicy": {
    "unknownField": "deny",
    "serverOnlyDependenciesNeverSerialized": true
  },
  "defaultsProfile": "platform.core-field-defaults.v1",
  "defaultsProfileRef": "platform/core-field-defaults.v1.json",
  "query": {
    "search": [],
    "filters": [],
    "sorts": []
  },
  "artifactHash": "sha256:d3eacf8331b4182b486136a5301b27110c2a66dc14444dad4a610fdbc2d2c0d3"
}
