{
  "schema": "athyper.compiled-entity-artifact/2.0-draft",
  "schemaVersion": 2,
  "contractStatus": "draft_for_review",
  "artifactType": "core",
  "artifactKey": "business_partner_relationship/core",
  "entityCode": "business_partner_relationship",
  "plane": "neon",
  "storage": {
    "kind": "handler_projection",
    "sourceObjects": [
      "master.business_partner_relationship"
    ],
    "primaryObject": "master.business_partner_relationship",
    "idField": "id",
    "tenantField": "tenant_id",
    "genericWriteEnabled": false
  },
  "fields": [
    {
      "key": "id",
      "binding": {
        "sourceObject": "master.business_partner_relationship",
        "column": "id"
      },
      "dataType": "uuid",
      "storageType": "uuid",
      "nullable": false,
      "label": {
        "labelKey": "entity.business_partner_relationship.core.fields.id.label",
        "defaultText": "Id"
      },
      "valueOrigin": "stored",
      "readPolicy": "authorized_projection",
      "uiFacets": {
        "visibility": "hidden",
        "editability": "readonly"
      },
      "writePolicy": "system_managed"
    },
    {
      "key": "source_business_partner_id",
      "binding": {
        "sourceObject": "master.business_partner_relationship",
        "column": "source_business_partner_id"
      },
      "dataType": "uuid",
      "storageType": "uuid",
      "nullable": false,
      "label": {
        "labelKey": "entity.business_partner_relationship.core.fields.source_business_partner_id.label",
        "defaultText": "Source Business Partner"
      },
      "valueOrigin": "stored"
    },
    {
      "key": "target_business_partner_id",
      "binding": {
        "sourceObject": "master.business_partner_relationship",
        "column": "target_business_partner_id"
      },
      "dataType": "uuid",
      "storageType": "uuid",
      "nullable": false,
      "label": {
        "labelKey": "entity.business_partner_relationship.core.fields.target_business_partner_id.label",
        "defaultText": "Target Business Partner"
      },
      "valueOrigin": "stored"
    },
    {
      "key": "relationship_type_code",
      "binding": {
        "sourceObject": "master.business_partner_relationship",
        "column": "relationship_type_code"
      },
      "dataType": "string",
      "storageType": "text",
      "nullable": false,
      "label": {
        "labelKey": "entity.business_partner_relationship.core.fields.relationship_type_code.label",
        "defaultText": "Relationship Type"
      },
      "valueOrigin": "stored"
    },
    {
      "key": "country_code",
      "binding": {
        "sourceObject": "master.business_partner_relationship",
        "column": "country_code"
      },
      "dataType": "string",
      "storageType": "character(2)",
      "nullable": true,
      "label": {
        "labelKey": "entity.business_partner_relationship.core.fields.country_code.label",
        "defaultText": "Country"
      },
      "valueOrigin": "stored"
    },
    {
      "key": "effective_from",
      "binding": {
        "sourceObject": "master.business_partner_relationship",
        "column": "effective_from"
      },
      "dataType": "date",
      "storageType": "date",
      "nullable": true,
      "label": {
        "labelKey": "entity.business_partner_relationship.core.fields.effective_from.label",
        "defaultText": "Effective From"
      },
      "valueOrigin": "stored"
    },
    {
      "key": "effective_until",
      "binding": {
        "sourceObject": "master.business_partner_relationship",
        "column": "effective_until"
      },
      "dataType": "date",
      "storageType": "date",
      "nullable": true,
      "label": {
        "labelKey": "entity.business_partner_relationship.core.fields.effective_until.label",
        "defaultText": "Effective Until"
      },
      "valueOrigin": "stored"
    },
    {
      "key": "status",
      "binding": {
        "sourceObject": "master.business_partner_relationship",
        "column": "status"
      },
      "dataType": "string",
      "storageType": "master.partner_extension_status_d",
      "nullable": false,
      "label": {
        "labelKey": "entity.business_partner_relationship.core.fields.status.label",
        "defaultText": "Status"
      },
      "valueOrigin": "stored"
    }
  ],
  "businessContext": {
    "scopeKind": "tenant",
    "recordOwnershipSource": "persisted_record",
    "selectorMayChangeOwnership": false,
    "aggregateAccess": "explicit_authorization_only"
  },
  "relations": [],
  "capabilities": {
    "audit": {
      "enabled": true,
      "serviceKey": "platform.audit.v1",
      "load": "lazy"
    },
    "comments": {
      "enabled": false
    },
    "attachments": {
      "enabled": false
    },
    "customFields": {
      "enabled": false,
      "reasonCode": "CUSTOM_ATTRIBUTES_STORAGE_NOT_APPROVED"
    }
  },
  "querySafetyLimits": {
    "maxFilters": 20,
    "maxPageSize": 100,
    "maxSortFields": 3,
    "maxFilterDepth": 3,
    "presentationMayOnlyNarrow": true
  },
  "readinessFacts": [],
  "dependencies": [
    "platform/core-field-defaults.v1"
  ],
  "validationAuthority": {
    "fieldRules": "compiled_and_server_enforced",
    "domainRules": "registered_handler_and_database_constraints",
    "missingEvaluator": "block_write",
    "uiVisibilityGrantsAccess": false
  },
  "projectionPolicy": {
    "unknownField": "deny",
    "serverOnlyDependenciesNeverSerialized": true
  },
  "serverDependencies": [
    {
      "sourceObject": "master.business_partner_relationship",
      "column": "tenant_id",
      "purpose": "identity_context_or_concurrency"
    }
  ],
  "defaultsProfile": "platform.core-field-defaults.v1",
  "defaultsProfileRef": "platform/core-field-defaults.v1.json",
  "query": {
    "search": [],
    "filters": [],
    "sorts": []
  },
  "artifactHash": "sha256:fa369bbefc8014a89296f6b12ae7a18c2d86f59c76a9a33f6c357eecd3667de7"
}
