{
  "schema": "athyper.compiled-entity-artifact/2.0-draft",
  "schemaVersion": 2,
  "contractStatus": "draft_for_review",
  "artifactType": "core",
  "artifactKey": "supplier_company_profile/core",
  "entityCode": "supplier_company_profile",
  "plane": "neon",
  "storage": {
    "kind": "table",
    "sourceObjects": [
      "master.company_code_supplier_profile"
    ],
    "primaryObject": "master.company_code_supplier_profile",
    "idField": "id",
    "tenantField": "tenant_id",
    "genericWriteEnabled": false
  },
  "fields": [
    {
      "key": "id",
      "binding": {
        "sourceObject": "master.company_code_supplier_profile",
        "column": "id"
      },
      "dataType": "uuid",
      "nullable": false,
      "label": {
        "labelKey": "entity.supplier_company_profile.core.fields.id.label",
        "defaultText": "Id"
      },
      "valueOrigin": "stored",
      "readPolicy": "authorized_projection",
      "storageType": "uuid",
      "uiFacets": {
        "visibility": "hidden",
        "editability": "readonly"
      },
      "writePolicy": "system_managed"
    },
    {
      "key": "business_partner_id",
      "binding": {
        "sourceObject": "master.company_code_supplier_profile",
        "column": "business_partner_id"
      },
      "dataType": "uuid",
      "nullable": false,
      "label": {
        "labelKey": "entity.supplier_company_profile.core.fields.business_partner_id.label",
        "defaultText": "Business Partner"
      },
      "valueOrigin": "stored",
      "readPolicy": "authorized_projection",
      "storageType": "uuid",
      "display": {
        "lookup": {
          "code": "master.business_partner"
        }
      }
    },
    {
      "key": "company_code_id",
      "binding": {
        "sourceObject": "master.company_code_supplier_profile",
        "column": "company_code_id"
      },
      "dataType": "uuid",
      "nullable": false,
      "label": {
        "labelKey": "entity.supplier_company_profile.core.fields.company_code_id.label",
        "defaultText": "Company"
      },
      "valueOrigin": "stored",
      "readPolicy": "authorized_projection",
      "storageType": "uuid",
      "display": {
        "lookup": {
          "code": "master.company_code"
        }
      }
    },
    {
      "key": "currency_code",
      "binding": {
        "sourceObject": "master.company_code_supplier_profile",
        "column": "currency_code"
      },
      "dataType": "string",
      "nullable": true,
      "label": {
        "labelKey": "entity.supplier_company_profile.core.fields.currency_code.label",
        "defaultText": "Currency"
      },
      "valueOrigin": "stored",
      "readPolicy": "authorized_projection",
      "storageType": "character(3)",
      "display": {
        "lookup": {
          "code": "shared.currency"
        }
      }
    },
    {
      "key": "payment_term_id",
      "binding": {
        "sourceObject": "master.company_code_supplier_profile",
        "column": "payment_term_id"
      },
      "dataType": "uuid",
      "nullable": true,
      "label": {
        "labelKey": "entity.supplier_company_profile.core.fields.payment_term_id.label",
        "defaultText": "Payment terms"
      },
      "valueOrigin": "stored",
      "readPolicy": "authorized_projection",
      "storageType": "uuid",
      "display": {
        "lookup": {
          "code": "master.payment_term"
        }
      }
    },
    {
      "key": "status",
      "binding": {
        "sourceObject": "master.company_code_supplier_profile",
        "column": "status"
      },
      "dataType": "string",
      "nullable": false,
      "label": {
        "labelKey": "entity.supplier_company_profile.core.fields.status.label",
        "defaultText": "Status"
      },
      "valueOrigin": "stored",
      "readPolicy": "authorized_projection",
      "storageType": "master.partner_extension_status_d",
      "uiFacets": {
        "visibility": "visible",
        "editability": "readonly"
      },
      "writePolicy": "system_managed",
      "display": {
        "lookup": {
          "options": [
            {
              "value": "draft",
              "label": {
                "labelKey": "entity.company_profile.status.draft",
                "defaultText": "Draft"
              }
            },
            {
              "value": "active",
              "label": {
                "labelKey": "entity.company_profile.status.active",
                "defaultText": "Active"
              }
            },
            {
              "value": "inactive",
              "label": {
                "labelKey": "entity.company_profile.status.inactive",
                "defaultText": "Inactive"
              }
            },
            {
              "value": "archived",
              "label": {
                "labelKey": "entity.company_profile.status.archived",
                "defaultText": "Archived"
              }
            }
          ]
        }
      }
    }
  ],
  "businessContext": {
    "scopeKind": "company",
    "recordOwnershipSource": "persisted_record",
    "selectorMayChangeOwnership": false,
    "aggregateAccess": "explicit_authorization_only",
    "requiredCoordinates": [
      "companyCodeId",
      "operatingOrganizationId",
      "asOf"
    ],
    "legalEntitySource": "selected_company_code",
    "requiredCapability": "procurement",
    "eligibilityChecks": [
      "principal_action_permission",
      "company_belongs_to_legal_entity",
      "effective_org_company_assignment",
      "effective_org_capability",
      "effective_partner_role_participation"
    ],
    "hierarchy": {
      "systemRootSelectableForCommands": false,
      "descendantBrowse": "explicit_authorized_expansion",
      "ancestorDoesNotGrantLeafAuthority": true
    }
  },
  "relations": [],
  "capabilities": {
    "audit": {
      "enabled": true,
      "serviceKey": "platform.audit.v1",
      "load": "lazy"
    },
    "comments": {
      "enabled": false
    },
    "attachments": {
      "enabled": false
    },
    "customFields": {
      "enabled": false,
      "reasonCode": "CUSTOM_ATTRIBUTES_STORAGE_NOT_APPROVED"
    }
  },
  "querySafetyLimits": {
    "maxFilters": 20,
    "maxPageSize": 100,
    "maxSortFields": 3,
    "maxFilterDepth": 3,
    "presentationMayOnlyNarrow": true
  },
  "readinessFacts": [],
  "dependencies": [
    "platform/core-field-defaults.v1"
  ],
  "validationAuthority": {
    "fieldRules": "compiled_and_server_enforced",
    "domainRules": "registered_handler_and_database_constraints",
    "missingEvaluator": "block_write",
    "uiVisibilityGrantsAccess": false
  },
  "projectionPolicy": {
    "unknownField": "deny",
    "serverOnlyDependenciesNeverSerialized": true
  },
  "serverDependencies": [
    {
      "sourceObject": "master.company_code_supplier_profile",
      "column": "company_code_id",
      "purpose": "identity_context_or_concurrency"
    },
    {
      "sourceObject": "master.company_code_supplier_profile",
      "column": "id",
      "purpose": "identity_context_or_concurrency"
    },
    {
      "sourceObject": "master.company_code_supplier_profile",
      "column": "business_partner_id",
      "purpose": "identity_context_or_concurrency"
    },
    {
      "sourceObject": "master.company_code_supplier_profile",
      "column": "tenant_id",
      "purpose": "identity_context_or_concurrency"
    }
  ],
  "defaultsProfile": "platform.core-field-defaults.v1",
  "defaultsProfileRef": "platform/core-field-defaults.v1.json",
  "artifactHash": "sha256:7295d20d3fbd1182c6b1d4493a54d0e3a46c2148d65f0f3c9edf4f25f1ad31ee",
  "query": {
    "search": [],
    "filters": [],
    "sorts": []
  }
}
