{
  "schema": "athyper.compiled-entity-artifact/2.0-draft",
  "schemaVersion": 2,
  "contractStatus": "draft_for_review",
  "artifactType": "core",
  "artifactKey": "bank_identifier/core",
  "entityCode": "bank_identifier",
  "plane": "neon",
  "storage": {
    "kind": "table",
    "primaryObject": "shared.bank_identifier",
    "sourceObjects": [
      "shared.bank_identifier"
    ],
    "idField": "id",
    "tenantField": null,
    "genericWriteEnabled": false
  },
  "fields": [
    {
      "key": "id",
      "binding": {
        "sourceObject": "shared.bank_identifier",
        "column": "id"
      },
      "dataType": "uuid",
      "storageType": "uuid",
      "nullable": false,
      "label": {
        "labelKey": "entity.bankIdentifier.core.fields.id.label",
        "defaultText": "Id"
      },
      "valueOrigin": "stored",
      "readPolicy": "authorized_projection"
    },
    {
      "key": "institutionId",
      "binding": {
        "sourceObject": "shared.bank_identifier",
        "column": "institution_id"
      },
      "dataType": "uuid",
      "storageType": "uuid",
      "nullable": false,
      "label": {
        "labelKey": "entity.bankIdentifier.core.fields.institutionId.label",
        "defaultText": "Bank institution"
      },
      "valueOrigin": "stored",
      "readPolicy": "authorized_projection"
    },
    {
      "key": "branchId",
      "binding": {
        "sourceObject": "shared.bank_identifier",
        "column": "branch_id"
      },
      "dataType": "uuid",
      "storageType": "uuid",
      "nullable": true,
      "label": {
        "labelKey": "entity.bankIdentifier.core.fields.branchId.label",
        "defaultText": "Bank branch"
      },
      "valueOrigin": "stored",
      "readPolicy": "authorized_projection"
    },
    {
      "key": "scheme",
      "binding": {
        "sourceObject": "shared.bank_identifier",
        "column": "scheme"
      },
      "dataType": "string",
      "storageType": "text",
      "nullable": false,
      "label": {
        "labelKey": "entity.bankIdentifier.core.fields.scheme.label",
        "defaultText": "Scheme"
      },
      "valueOrigin": "stored",
      "readPolicy": "authorized_projection"
    },
    {
      "key": "value",
      "binding": {
        "sourceObject": "shared.bank_identifier",
        "column": "value"
      },
      "dataType": "string",
      "storageType": "text",
      "nullable": false,
      "label": {
        "labelKey": "entity.bankIdentifier.core.fields.value.label",
        "defaultText": "Identifier"
      },
      "valueOrigin": "stored",
      "readPolicy": "authorized_projection"
    }
  ],
  "businessContext": {
    "scopeKind": "shared_reference"
  },
  "referencePicker": {
    "valueField": "id",
    "labelField": "value",
    "displayFormat": "{value}",
    "allowedTokens": [
      "value"
    ],
    "load": "bounded_lookup"
  },
  "dependencies": [
    "platform/core-field-defaults.v1"
  ],
  "validationAuthority": {
    "fieldRules": "compiled_and_server_enforced",
    "domainRules": "registered_handler_and_database_constraints",
    "missingEvaluator": "block_write",
    "uiVisibilityGrantsAccess": false
  },
  "projectionPolicy": {
    "unknownField": "deny",
    "serverOnlyDependenciesNeverSerialized": true
  },
  "defaultsProfile": "platform.core-field-defaults.v1",
  "defaultsProfileRef": "platform/core-field-defaults.v1.json",
  "query": {
    "search": [],
    "filters": [],
    "sorts": []
  },
  "artifactHash": "sha256:ae7d34fac10d91b2d42e1b1ee112ba9ee0577c46b03e2d359ed9f1958076d9b4"
}
